Programme_ID,Programme_Name,Programme_Short_Description,Programme_Location,Programme_Access,Programme_Detailed_Description,Image,Page URL,Narratives_Programme_Is_Part_Of,Discipline_Programme_Is_Part_Of
343,Pavilion Encounter Iced Sound,Highlighting the climate crisis through spatial and sonic experience,"Strijp-S area, Ketelhuisplein, Ketelhuisplein",Free,"Pavilion Encounter Iced Sound is a pavilion with sound installation created by architecture practice rotative studio (Alexandra Sonnemans and Caterina Viguera) and composer Ramon Landolt.

Located at Ketelhuisplein, the project highlights the climate crisis through spatial and sonic experience.",https://ddw.ams3.cdn.digitaloceanspaces.com/thumbs/encounter-iced-sound-rs-1_1693552907_1800x1010.jpg,https://ddw.nl/en/programme/9686/pavilion-encounter-iced-sound,"[""EXHIBITIONS"", ""OUR THRIVING PLANET"", ""INDEPENDENT & CRITICAL DESIGN""]",Art Design
344,Peltchair,"Sit down, relax and power the world of the future","Strijp-S area, Microlab Hall, Kastanjelaan 400",Free with DDW Ticket,"The call for climate action echoes louder than ever before. Gather your strength, for within each of us lies the potential to produce power. Power unleashed by, in stillness, sitting on the Peltchair that harnesses the warmth within you to light up the chair and brighten our future.",https://ddw.ams3.cdn.digitaloceanspaces.com/thumbs/peltchair-04a-studio-synergy-lilian-van-daal_1693477335_1800x1010.jpg,https://ddw.nl/en/programme/10146/peltchair,"[""EXHIBITIONS"", ""OUR THRIVING PLANET"", ""SPECULATIVE & SOCIAL DESIGN""]",Design Research
345,Performing Empathy,Using Theatre Techniques to Deepen Understanding,"Strijp-S area, Blue Collar Hotel, Klokgebouw 10",,"Embark on a journey with DesignThinkers & playback theatre practitioners. Explore a design-performance synergy while creatively challenging the 'empathy' buzzword. Join an enlightening keynote followed by an immersive experience merging story theatre and Design Thinking. Interact, immerse, discover.",https://ddw.ams3.cdn.digitaloceanspaces.com/thumbs/3g8a0640_1693493524_1800x1010.jpeg,https://ddw.nl/en/programme/10162/performing-empathy,"[""WORKSHOP"", ""OUR EQUAL SOCIETY"", ""INDEPENDENT & CRITICAL DESIGN""]",Social Design
346,PERPETUUM MOBILE by KIKI X JOOST,The workshop as a self-propelled machine where creations flow endlessly and each action triggers a reaction.,"Canal area, Kiki and Joost, Gabriël Metsulaan 1 - entrance Kanaaldijk Zuid",,"Perpetuum Mobile: perpetual motion. Kiki and Joost's workshop operate as a living, breathing entity. It embodies the essence of perpetual motion, a captivating symphony where ideas flow, ideas transform, and the creative energy propels their endeavors forward.",https://ddw.ams3.cdn.digitaloceanspaces.com/thumbs/structuring-chaos-yelllow-06-lr_1691494912_1800x1010.jpg,https://ddw.nl/en/programme/10452/perpetuum-mobile-by-kiki-x-joost,"[""EXHIBITIONS"", ""PRODUCT & CRAFT DESIGN""]",Art Design
347,PFDMLEO,Post Fragmentation Debris Mitigation for Low Earth Orbit,"Strijp-S area, Klokgebouw | Hall 2, Klokgebouw 50",Free with DDW Ticket,PFDMLEO is a modular satellite cluster to collect debris after a satellite collision equipped with sophisticated Whipple shields.The satellite cluster is partially perforated by the collision to capture the debris between the multiple layers of the shield and removed from orbit.,https://ddw.ams3.cdn.digitaloceanspaces.com/thumbs/gdg-1_1694377900_1800x1010.jpg,https://ddw.nl/en/programme/11007/pfdmleo,,
348,PHYGITAL WORLDS,"Discover a project merging physical and digital through interactive wearables, bringing tech and fashion together for a new immersive experience.","Strijp-S area, VEEM floor 8, Torenallee 100",Free,My project blends digital and physical design through an interactive collection. Fusing physical design with digital/technological design. Creating wearable pieces that activate upon touch. Pushing the boundaries within fashion design.,https://ddw.ams3.cdn.digitaloceanspaces.com/thumbs/whatsapp-image-2023-08-24-at-133402_1693317397_1800x1010.jpeg,https://ddw.nl/en/programme/9954/phygital-worlds,"[""EXHIBITIONS"", ""OUR DIGITAL FUTURE"", ""SPECULATIVE & SOCIAL DESIGN""]",Interaction Design
349,"PIANI - circular, light, convertible","PIANI is a clearly designed storage space, sustainable and made for the future in circularity.","Strijp T+R area, Piet Hein Eek, Halvemaanstraat 30",Free,"BFGF Design Studios developed a shelf system made of mono-materials that does not require the usual panel materials. PIANI is made of solid wood and designed to easily dis- and reassemble. The countless customization options with circular designed inserts ensure long-term, even timeless use.",https://ddw.ams3.cdn.digitaloceanspaces.com/thumbs/gerrit-parts-of-piani_1693383580_1800x1010.jpeg,https://ddw.nl/en/programme/10163/piani-circular-light-convertible,"[""EXHIBITIONS"", ""OUR LIVING ENVIRONMENT"", ""PRODUCT & CRAFT DESIGN""]",Industrial Design
350,Planter tiles,Bio-receptivity research,"Station area, Fuutlaan 12c, Fuutlaan 12c",Free,"Planter tiles explores the integration of 3D printing technology and natural organisms, specifically mosses, to design and construct bioreceptive tiles. Seeking to enhance bioreceptivity and foster the development of performative architectures that offer ecological benefits and aesthetic value.",https://ddw.ams3.cdn.digitaloceanspaces.com/thumbs/01-08-ious-studio-3d-clay-printing-planter-tiles-axo-3-15_1693901002_1800x1010.jpg,https://ddw.nl/en/programme/10931/planter-tiles,,
351,Pol/der (vriens),,"Strijp-S area, VEEM floor 8, Torenallee 100",Free,"maps the radical undercurrent developing at the cultural and political fringes. Alienation, network culture, capitalism, and the emergence of conspiracy as collective myth-making — or, shared fictions that make themselves actual, through memetic repitition.",https://ddw.ams3.cdn.digitaloceanspaces.com/thumbs/polder-vriens-dsc7482-klein_1693947947_1800x1010.jpg,https://ddw.nl/en/programme/10960/polder-vriens,,
352,Portray Me,,"Centre area, Creative Town, Het College 22",,"In a world where visual cues often shape our initial perceptions, Portray Me creates a space that encourages unbiased connections by eliminating the reliance on visual and auditive cues.

Step into this interactive installation where voices weave portraits, and connections transcend looks.",https://ddw.ams3.cdn.digitaloceanspaces.com/thumbs/banner2portrayme-banner1800x1010px-1_1693575041_1800x1010.png,https://ddw.nl/en/programme/10094/portray-me,"[""EXHIBITIONS"", ""OUR EQUAL SOCIETY"", ""SPECULATIVE & SOCIAL DESIGN"", ""GROUP EXHIBITION""]",Social Design
353,Poscura,Intelligent workwear clothing for geriatric nurses,"Strijp-S area, Klokgebouw | Hall 2, Klokgebouw 50",Free with DDW Ticket,Poscura is intelligent workwear clothing for geriatric nurses. It provides physical support during back-straining activities while reminding the staff to maintain an ergonomic posture.,https://ddw.ams3.cdn.digitaloceanspaces.com/thumbs/titelbild-cover-image_1694379312_1800x1010.jpg,https://ddw.nl/en/programme/11011/poscura,,
354,Possession to Nature,,"Strijp T+R area, BioArt Laboratories, Oirschotsedijk 14-10",Free,"This project has been started from questions about a territorial dispute over ""the island"".

What does it mean to possess? We try to own nature and fight over it through money, borders, boundaries, and maps in the language we have defined. But from nature's perspective, such language does not exist.",https://ddw.ams3.cdn.digitaloceanspaces.com/thumbs/possession-to-nature-01_1693508595_1800x1010.jpg,https://ddw.nl/en/programme/10454/possession-to-nature,"[""EXHIBITIONS"", ""OUR THRIVING PLANET"", ""INDEPENDENT & CRITICAL DESIGN""]",Social Design
355,presents: Simone Post & Atelier Reservé,,"Hallenweg area, Atelier NL, Bergmannstraat 76",Free,"Re—gained is a social design label that aims to stimulate discussion through design research about how we deal with products in this day and age. She does this based on the conviction that waste of raw materials should be radically reduced, and that design can make a difference.",https://ddw.ams3.cdn.digitaloceanspaces.com/thumbs/rg-logo_1693510063_1800x1010.jpg,https://ddw.nl/en/programme/10883/presents-simone-post-amp-atelier-reserve,,
356,PRIMAL A.I.,A critical staging of Artificial Intelligence as an extractive tool for design,"Strijp-S area, VEEM floor 8, Torenallee 100",Free,In »Primal A.I.« A204 takes a closer look at the contemporary emergence of artificial intelligence. Different machine learning models are used to establish a symbolic link between A.I. and its human origin by creating conceptual tools of extraction and labour through and for artificial intelligence.,https://ddw.ams3.cdn.digitaloceanspaces.com/thumbs/primal-ai-06_1692115414_1800x1010.jpg,https://ddw.nl/en/programme/9879/primal-ai,"[""EXHIBITIONS"", ""OUR DIGITAL FUTURE"", ""INDEPENDENT & CRITICAL DESIGN""]",Design Research
358,Prototype Party!,"A festive display of Erik Stehmann's playful designs, including unveiled prototypes and brand new creations.","Sectie-C area, Hall 6 - Kop van 6, Daalakkersweg 6",,"Get ready to be swept away in a world of wonder during the “Prototype Party!”. The designs of Erik Stehmann come to life in a festive exhibition that aims to surprise and entertain. With a dash of quirky innovation, his designs evoke smiles and conversations.",https://ddw.ams3.cdn.digitaloceanspaces.com/thumbs/6_1693474908_1800x1010.jpg,https://ddw.nl/en/programme/10119/prototype-party,"[""EXHIBITIONS"", ""PRODUCT & CRAFT DESIGN""]",Industrial Design
359,Psychological Safety workshop,Discover the key to high performing teams,"Centre area, Cognizant Eindhoven Office, Clausplein 10A (4th floor)",,"In the workshop you will learn about the role and importance of Psychological Safety in team performance. By the end of the workshop, you will be able to better understand your own team dynamic. You will learn what you can do to improve the collaboration, performance and outcomes of your team.",https://ddw.ams3.cdn.digitaloceanspaces.com/thumbs/workshop-nl_1693501385_1800x1010.jpeg,https://ddw.nl/en/programme/10748/psychological-safety-workshop,"[""WORKSHOP"", ""OUR EQUAL SOCIETY"", ""SPECULATIVE & SOCIAL DESIGN""]",Service Design
360,Psychological Safety workshop,Discover the key to high performing teams,"Centre area, Cognizant Eindhoven Office, Clausplein 10A (4th floor)",,"In this workshop you will learn about the role and importance of Psychological Safety in team performance. By the end of the workshop, you will understand your own team dynamic better and you will learn what you can do to improve the collaboration and performance of your team and organization.",https://ddw.ams3.cdn.digitaloceanspaces.com/thumbs/workshop-nl_1693501522_1800x1010.jpeg,https://ddw.nl/en/programme/10183/psychological-safety-workshop,"[""WORKSHOP"", ""OUR EQUAL SOCIETY"", ""SPECULATIVE & SOCIAL DESIGN""]",Service Design
361,"Px, let's think outside of the box",For sea- and air freight we use reusable containers but over 600 million internet purchase per year are packed in one way carton boxes?,"Centre area, Schellens Fabriek, Bleekweg 1M",Free,"In Px nine small companies have aligned. Our mission is to design a circular flow of sustainable, re-usable packaging for E-commerce. We are based in Eindhoven. We would like to prove that economic activity does not have to come at the cost of our natural resources. Be re-using the same Px.",https://ddw.ams3.cdn.digitaloceanspaces.com/thumbs/istock-901089264-3_1693476957_1800x1010.jpg,https://ddw.nl/en/programme/10630/px-lets-think-outside-of-the-box,,
362,RAD1ANT0,Illuminating: Het Koelhuis,"Canal area, Koelhuis Eindhoven, Dirk Boutslaan 1",Free,"Taco Tarn Joosting Bunk creates a dynamic, audiovisual installation “RAD1ANT0”, utilizing analog industrial lighting to accentuate Koelhuis’ historical environment. This site-specific installation contemplates the present, raw condition of the building, that is about to change.",https://ddw.ams3.cdn.digitaloceanspaces.com/thumbs/tacotarn-profielfoto-2-downscaled_1694430469_1800x1010.jpg,https://ddw.nl/en/programme/10872/rad1ant0,,
363,Radical City inc.,Explores routes to an alternative urban landscape,"Station area, Spoor K (Studio #3), Fuutlaan 14K",Free,"The Radical City inc. exhibition gives shape to a new climate-proof and nature inclusive city. Artists, designers and architects challenge conservative notions of city life and explore different routes to a new, future-oriented urban landscape.",https://ddw.ams3.cdn.digitaloceanspaces.com/thumbs/banner-rci_1692354099_1800x1010.jpg,https://ddw.nl/en/programme/10444/radical-city-inc,"[""EXHIBITIONS"", ""OUR LIVING ENVIRONMENT"", ""INDEPENDENT & CRITICAL DESIGN""]",Bio Design
364,Random Studio,,"Strijp-S area, Microlab Hall, Kastanjelaan 400",Free with DDW Ticket,,https://ddw.ams3.cdn.digitaloceanspaces.com/thumbs/1-random-studio-romantic-futurism-dda23-data-interaction_1689586918_1800x1010.jpeg,https://ddw.nl/en/programme/10483/random-studio,,
365,Raw Color – Multiply,The exhibition celebrates Raw Color as the winner of Limburg Design Award 2023 and shows a selection of the studio's work from the past 15 years.,"Strijp T+R area, Raw Color Studio, Beeldbuisring 30",,‘Multiply’ stands for overlapping and mixing colours and represents the many forms of colour research that are central to the studio’s work. The materialisation of colour can be seen as the core of the multidisciplinary studio. The exhibition unites an overview of final outcomes and process.,https://ddw.ams3.cdn.digitaloceanspaces.com/thumbs/230606-rc-cuypershuis-expo-16_1692286813_1800x1010.jpg,https://ddw.nl/en/programme/9923/raw-color-multiply,"[""EXHIBITIONS"", ""SIGNATURE & COLLECTIBLE DESIGN""]",Art Design
366,Re-imagine a picture of Wealth,"Activating an inner dialogue to invite questioning of the assumptions behind the definition of success, opening up a space for collective enrichment.","Strijp-S area, MICROLAB, KASTANJELAAN 400",,"Deep-rooted assumptions defining wealth are taught to us from childhood, framing our life-long definitions of wealth. Our project catalyses reflection & offers personal spaces for alternative experiences via embodiment. Collective wisdom then trains a natural language model to re-imagine true wealth",https://ddw.ams3.cdn.digitaloceanspaces.com/thumbs/what-is-wealth-cover_1694531394_1800x1010.jpg,https://ddw.nl/en/programme/10225/re-imagine-a-picture-of-wealth,"[""WORKSHOP"", ""OUR EQUAL SOCIETY"", ""INDEPENDENT & CRITICAL DESIGN""]",Social Design
367,Rediscover Your Rhythm,,"Strijp-S area, VEEM floor 8, Torenallee 100",Free,"An experience based on fear and stress where you can reconnect with your body to regain a sense of calm.

https://www.rubenmaas.nl/",https://ddw.ams3.cdn.digitaloceanspaces.com/thumbs/ruben-maas_1693949431_1800x1010.png,https://ddw.nl/en/programme/10962/rediscover-your-rythm,,
368,Réexister,The climate crisis is a geohistorical moment where pollution and sociocultural injustice are systematically linked.,"Station area, Design Perron, Fuutlaan 12",Free,The unity between the production of objects and food-making is linked to nomadic Kalmyk culture. It depends directly on the environment and the availability of resources. The applied research resulted in experimental objects based on cultural archetypes created from a nettle-based material.,https://ddw.ams3.cdn.digitaloceanspaces.com/thumbs/diploma-todaeva8_1692622622_1800x1010.jpg,https://ddw.nl/en/programme/10380/reexister,"[""EXHIBITIONS"", ""OUR LIVING ENVIRONMENT"", ""SPECULATIVE & SOCIAL DESIGN""]",Design Research
369,Reflections to reflections,HSLU – Lucerne school of art & design,"Woensel area, De GRRRAGE, De Greefstraat 6",Free,"Project outcomes from a six week workshop
Led by Michiel Martens from Studio Martens & Visser",https://ddw.ams3.cdn.digitaloceanspaces.com/thumbs/schermafbeelding-2023-07-10-om-144825_1688993322_1800x1010.png,https://ddw.nl/en/programme/10456/reflections-to-reflections,"[""EXHIBITIONS"", ""OUR LIVING ENVIRONMENT"", ""SIGNATURE & COLLECTIBLE DESIGN""]",Process Design
370,Reflective Resonance: Unveiling Unconscious Bonds,"""Reflective Resonance"" is a design/art project inspired by Tom Jacobs, a Design Academy alumnus.","Sectie-C area, Collaboration O, Daalakkersweg 6",Free with DDW Ticket,"The ""Man Machine,"" symbolizes the unity between humanity and technology, by revealing anthropological insights through Tom's work.",https://ddw.ams3.cdn.digitaloceanspaces.com/thumbs/img-0895_1693419790_1800x1010.jpg,https://ddw.nl/en/programme/10761/reflective-resonance-unveiling-unconscious-bonds,,
371,Regeneration - Fashion from the Ground Up,Fashion from the Ground Up,"Strijp-S area, New Order of Fashion LAB, Torenallee 22-06",Free with DDW Ticket or Entrance Fee,"To collectively explore the meaning of regeneration in fashion, New Order of Fashion unites twelve emerging designers from across the globe. Ready to embark on a holistic quest to heal fashion — and planet! — through a care for all approach.",https://ddw.ams3.cdn.digitaloceanspaces.com/thumbs/katerina-knight-the-healing-lace-2023-image-by-ruby-pluhar_1694522619_1800x1010.jpg,https://ddw.nl/en/programme/10184/regeneration-fashion-from-the-ground-up,,
372,Remembering by Feeling,"An exploratory journey into the intricate dance between memory, tactile sensation, and the interplay of light.","West area, Fashion Tech Farm, Zeelsterstraat 80",Free,"I am always curious about the connection between the perceptual experience of touching and the awareness that emerges within our bodies. How do these experiences constitute memories and, moreover, shape our imagination and understanding of reality?",https://ddw.ams3.cdn.digitaloceanspaces.com/thumbs/06main-image_1693225755_1800x1010.jpg,https://ddw.nl/en/programme/10089/remembering-by-feeling,"[""EXHIBITIONS"", ""SIGNATURE & COLLECTIBLE DESIGN""]",Art Design
373,Research to Reconnect,Researching and designing for a future proof everyday,"Strijp T+R area, Piet Hein Eek, Halvemaanstraat 30",Free,"House of Thol creates functional products that make green living easier.
These are the tangible results of thorough research and material experiments.
This DDW we showcase the difference between the House of Thol Brand and Studio, paving the way for future collaborative research projects.",https://ddw.ams3.cdn.digitaloceanspaces.com/thumbs/01-patella-crescenda-picking-up-disk_1693470384_1800x1010.jpg,https://ddw.nl/en/programme/10107/research-to-reconnect,"[""EXHIBITIONS"", ""OUR LIVING ENVIRONMENT"", ""PRODUCT & CRAFT DESIGN""]",Design Research
374,Resting Mayhem,/,"Hallenweg area, De Fabriek, Baarsstraat 38",Free,/,https://ddw.ams3.cdn.digitaloceanspaces.com/thumbs/7f36318a-496f-4ab8-bcb9-f32b6dc061a8_1693496540_1800x1010.jpeg,https://ddw.nl/en/programme/10793/resting-mayhem,,
375,Resting Reef: Restoring life through death,"A sustainable death care service that transforms human ashes into beautiful reef structures to commemorate past lives, while building new life.","Strijp T+R area, BioArt Laboratories, Oirschotsedijk 14-10",Free,"We develop a unique formula containing bone ash and crushed oyster shells to create beautiful 3D-printed reef structures that are then deployed in the ocean to regenerate marine life. The reefs are then cared for and monitored, and we provide support and rituals to people to connect with nature.",https://ddw.ams3.cdn.digitaloceanspaces.com/thumbs/resting-reef-colonised-structure_1691353238_1800x1010.jpeg,https://ddw.nl/en/programme/9974/resting-reef-restoring-life-through-death,"[""EXHIBITIONS"", ""OUR THRIVING PLANET"", ""SPECULATIVE & SOCIAL DESIGN""]",Social Design
376,Revealing Ribs,,"Station area, Design Perron, Fuutlaan 12",Free,"Revealing Ribs is a design project that aims to design knitted textiles by experimenting with rib knitting and patterns, with the aim of modifying the expression through the use of three-dimensional form.",https://ddw.ams3.cdn.digitaloceanspaces.com/thumbs/bild-5_1693467808_1800x1010.jpg,https://ddw.nl/en/programme/10777/revealing-ribs,,
377,Ribbed,"Ripped is a series in metal, wood and ceramic. All 3 projects are very different from each other but start from the same concept.","Sectie-C area, Hall G, Daalakkersweg 6",,"Ripped is a series in metal, wood and ceramic. All 3 projects are very different from each other but start from the same concept.

The natural line of the bark has been the starting point for processing in ceramics and metal. Where organic shapes and machine operations come together",https://ddw.ams3.cdn.digitaloceanspaces.com/thumbs/schermafbeelding-2023-08-28-om-165502_1693234513_1800x1010.png,https://ddw.nl/en/programme/10249/ribbed,"[""EXHIBITIONS"", ""OUR DIGITAL FUTURE"", ""SIGNATURE & COLLECTIBLE DESIGN""]",Interior Design
378,RIZOOM,A series of reflective light objects that invite you to look at reality in a different way.,"Canal area, APTUM (by Ontwerpduo) | Peelcentrale NRE, Gashouder 13",Free,"A rhizome is an underground root structure that grows horizontally, proliferating rampantly and producing a multitude of lines and branches.
It is a symbol for thinking without a straight line or fixed structure, in a network of ideas and thoughts that constantly creates new connections.",https://ddw.ams3.cdn.digitaloceanspaces.com/thumbs/aptum-x-lucasenlucas-rizoom1_1694095545_1800x1010.jpg,https://ddw.nl/en/programme/10004/rizoom,"[""EXHIBITIONS"", ""SIGNATURE & COLLECTIBLE DESIGN""]",Design Research
379,Roadmap to circularity,Everything you use becomes waste. Nothing we can do about it. What we can do something about what we do with the waste.,"Strijp T+R area, Piet Hein Eek, Halvemaanstraat 30",Access,"Everything you use eventually becomes waste. There's nothing you can do about that. But we can change how we deal with that. In fact, everyone is obligated to do something about it: Netherlands must be 50% circular by 2030. That means that 50% of everything you use should find a next life.",https://ddw.ams3.cdn.digitaloceanspaces.com/thumbs/dump-design-collective-klein_1694762208_1800x1010.png,https://ddw.nl/en/programme/10747/roadmap-to-circularity,,
380,Roots collection,A collection result of a research that develops through experimentation,"Sectie-C area, Hall 14 - B, Daalakkersweg 14-24",,"This collection It consists of multiple series of objects for the habitat. The chandeliers are handmade with ceramics extrusions, silicone modelling, plastics recycling, raffia weaving, metal casting and led light connections.",https://ddw.ams3.cdn.digitaloceanspaces.com/thumbs/230406-michela-dangelo-roots-039-v10_1693471522_1800x1010.jpg,https://ddw.nl/en/programme/10450/roots-collection,"[""EXHIBITIONS"", ""OUR LIVING ENVIRONMENT"", ""PRODUCT & CRAFT DESIGN""]",Design Research
381,Ruta: Waking up in the future,,"Strijp T+R area, BioArt Laboratories, Oirschotsedijk 14-10",Free,A fungi-inspired alarm clock that offers a glimpse into a harmonious future where nature and humanity coexist on equal terms. This sensory design invites participants to interact with a colony of 'beings' that sense and communicate with each other.,https://ddw.ams3.cdn.digitaloceanspaces.com/thumbs/ruta_1693517925_1800x1010.png,https://ddw.nl/en/programme/9866/ruta-waking-up-in-the-future,"[""EXHIBITIONS"", ""OUR THRIVING PLANET"", ""SPECULATIVE & SOCIAL DESIGN""]",Bio Design
382,Sacred Markings,"Exploring our innate desire to leave a lasting imprint and the significance of
marking things as an expression of our humanity through objects.","Station area, Stationshal - Zuidhal - Eindhoven Centraal Station, Stationsplein 22",Free,"Exploring our innate desire to leave a lasting imprint and the significance of
marking things as an expression of our humanity, Jiin Yoon, Charlène
Dannancier and, Bominarae Oh reflect on how hand-drawn metal objects,
geometric elements and tattoo drawings become vessels for personal
narratives.",https://ddw.ams3.cdn.digitaloceanspaces.com/thumbs/drawn-object-1_1694542446_1800x1010.JPG,https://ddw.nl/en/programme/10992/sacred-markings,,
383,Salta Heat House: Harvesting Extreme Heat,Extreme Heat for Regenerative Living,"Strijp-S area, Microlab Hall, Kastanjelaan 400",Free with DDW Ticket,"An underground haven in Salta, Argentina, ingeniously utilizing excess heat for self-sustaining systems, paired with resource-efficient agriculture and a pioneering ""heathouse."" With Argentina's record-breaking heatwaves and dire crop losses, we embark on a mission to redefine survival.",https://ddw.ams3.cdn.digitaloceanspaces.com/thumbs/lower-qual_1692349204_1800x1010.jpg,https://ddw.nl/en/programme/9998/salta-heat-house-harvesting-extreme-heat,"[""EXHIBITIONS"", ""OUR LIVING ENVIRONMENT"", ""INDEPENDENT & CRITICAL DESIGN""]",Design Research
385,Sampat Studio,,"Strijp-S area, Microlab Hall, Kastanjelaan 400",Free with DDW Ticket,,https://ddw.ams3.cdn.digitaloceanspaces.com/thumbs/1-sampat-studio-wayang-kulit-dda23-product-photo-by-marcos-kueh_1689582104_1800x1010.jpg,https://ddw.nl/en/programme/10496/sampat-studio,,
386,Scent and Memory,,"Strijp T+R area, Piet Hein Eek, Halvemaanstraat 30",Free,"“Kaori to Kioku” is a design project based in Japan and the Netherlands.
We connect the worlds of craftwork and scent with the concept of redesigning traditional design.",https://ddw.ams3.cdn.digitaloceanspaces.com/thumbs/kk-01a_1693252400_1800x1010.jpg,https://ddw.nl/en/programme/9772/scent-and-memory,"[""EXHIBITIONS"", ""OUR LIVING ENVIRONMENT"", ""PRODUCT & CRAFT DESIGN""]",Interior Design
