Programme_ID,Programme_Name,Programme_Short_Description,Programme_Location,Programme_Access,Programme_Detailed_Description,Image,Page URL,Narratives_Programme_Is_Part_Of,Discipline_Programme_Is_Part_Of
131,Designing Sustainable North Stars,"A new holistic approach to design truly sustainable products, that takes into account product, user and system","Strijp T+R area, Innovation Powerhouse, Zwaanstraat 31a",Access,"A newly developed design approach to tackle complex sustainable challenges in a holistic way. A unique process which show cases elements of physical and digital design, product engineering, user research, system thinking and service design, applied to a consumer electronic product: a baby monitor!",https://ddw.ams3.cdn.digitaloceanspaces.com/thumbs/bliss-product-1_1693832112_1800x1010.png,https://ddw.nl/en/programme/10527/designing-sustainable-north-stars,,
132,Designing with composite material waste,Conceptual prototypes demonstrating the possibilities of reusing composite material in new applications.,"Strijp T+R area, Innovation Powerhouse, Zwaanstraat 31a",Access,The difficulty with recycling composite materials is expected to result in millions of tons of waste. Three graduate students from the TU Delft explored the possibility of reusing these composites in new applications to preserve the value embedded in the material and developed a design approach.,https://ddw.ams3.cdn.digitaloceanspaces.com/thumbs/lamp-post_1690985450_1800x1010.jpg,https://ddw.nl/en/programme/10535/designing-with-composite-material-waste,,
133,Deze Beams,"DEZE BEAMS are perhaps the most sustainable product in the world, with which everyone can also get started.","Centre area, Schellens Fabriek, Bleekweg 1M",Free,"The world is in need of change. We need to consume more sustainably, recycle more, upcycle more and generally use fewer materials. More and more people are aware of this. With DEZE BEAMS we want to help people to offer more sustainable solutions.",https://ddw.ams3.cdn.digitaloceanspaces.com/thumbs/logo-pagina-1_1692801542_1800x1010.jpg,https://ddw.nl/en/programme/10141/deze-beams,"[""EXHIBITIONS"", ""OUR THRIVING PLANET"", ""PRODUCT & CRAFT DESIGN""]",Interior Design
134,Dialogues of the Unheard,Stories that matter,"Sectie-C area, Hall 16 - C, Daalakkersweg 16",,Design has the potential to serve narratives that have been underrepresented. We design to cultivate greater awareness. The works by six visionary young designers are crafted with this precise purpose in mind: to amplify and bring to the forefront those dialogues that have long remained unheard.,https://ddw.ams3.cdn.digitaloceanspaces.com/thumbs/artboard-4_1695675779_1800x1010.png,https://ddw.nl/en/programme/10407/dialogues-of-the-unheard,"[""EXHIBITIONS"", ""OUR EQUAL SOCIETY"", ""SPECULATIVE & SOCIAL DESIGN"", ""GROUP EXHIBITION""]",Social Design
135,Dickpic Photobooth,,"Strijp-S area, VEEM floor 8, Torenallee 100",Free,"Masculinity is still often linked to being a man and thus to being a sex man. In the installation Dickpik Photobooth, Clim Stoopen research this in a very literal way, where spectators can have their penis photographed.",https://ddw.ams3.cdn.digitaloceanspaces.com/thumbs/20230630-161316_1693950586_1800x1010.jpg,https://ddw.nl/en/programme/10963/dickpic-photobooth,,
136,Dicro Lamp,"Simple and visually light, the Dicro lamp attracts attention whether it's turned on or off.","Centre area, Schellens Fabriek, Bleekweg 1M",Free,"Dicro is a decorative lamp, designed to create a unique and appealing atmosphere through the combination of light and the dichroic vinyl it features.
When it's turned on, it creates an explosion of colors and brings the space to life. When it's turned off, it becomes a mirror of colors.",https://ddw.ams3.cdn.digitaloceanspaces.com/thumbs/dicro_1694623262_1800x1010.jpg,https://ddw.nl/en/programme/10943/dicro-lamp,,
137,Disembodied voices from beyond the horizon,"The embodiment of the ionosphere in a radio station with three satellites, that broadcast the battle of fragmented voices between Earth and space.","Hallenweg area, De Fabriek, Baarsstraat 38",Free,"The ionosphere is a natural electromagnetic field that embodies a discontinuous ghostly nature of information transmission. Three radio-satellites are interweaving the local, global, and celestial voices of the Ionosphere, to enact the fight for the radio spectrum, as an ethereal natural resource.",https://ddw.ams3.cdn.digitaloceanspaces.com/thumbs/2_1693345216_1800x1010.jpg,https://ddw.nl/en/programme/10304/disembodied-voices-from-beyond-the-horizon,"[""EXHIBITIONS"", ""OUR DIGITAL FUTURE"", ""INDEPENDENT & CRITICAL DESIGN""]",Design Research
138,Divide Unite,A room divider where the design is determined by the available waste material.,"Strijp T+R area, Piet Hein Eek, Halvemaanstraat 30",Free,"Our vision in this project is to create awareness about the value of reuse. The result of this can be seen in the series, Many shares of. During DDW we will show the translation in a room divider where the design is determined by the residual waste in collaboration with MONDiLAB.",https://ddw.ams3.cdn.digitaloceanspaces.com/thumbs/cv-bigart-karsboom-2-1900px-srgb-kopie_1692788738_1800x1010.jpeg,https://ddw.nl/en/programme/10235/divide-unite,"[""EXHIBITIONS"", ""OUR LIVING ENVIRONMENT"", ""PRODUCT & CRAFT DESIGN""]",Art Design
139,Dommel Vibes,The Dommel is a dynamic river flowing through a burgeoning city. How can we ensure that this waterway continues to play a shining role for Eindhoven?,"Strijp-S area, Onder de leidingen, Torenallee 22-04",,"Dommel Vibes dives into the rich life of the most important water in Eindhoven. Planting and water enrich the quality of city life for people and fauna. Offering opportunities, but also making demands of our growing and densifying city. So we are looking for a smart approach for now and the future.",https://ddw.ams3.cdn.digitaloceanspaces.com/thumbs/gem-dommel-vibes-campaign-v09-still-2400-lr_1693987708_1800x1010.png,https://ddw.nl/en/programme/9928/dommel-vibes,"[""EXHIBITIONS"", ""OUR LIVING ENVIRONMENT"", ""SPECULATIVE & SOCIAL DESIGN""]",Social Design
140,Dommel Vibes: De Verdieping,The Dommel is a dynamic river flowing through a burgeoning city. How can we ensure that this waterway continues to play a shining role for Eindhoven?,"Station area, Microstad, Professor Doctor Dorgelolaan 2",,"Dommel Vibes: De Verdieping (Into the Depths) is a series of sessions under the auspices of social design studio Cocosmos with TU/e and Design Academy Eindhoven students, various experts and stakeholders, exploring the Dommel as an ecological zone and an integral part of urban developments.",https://ddw.ams3.cdn.digitaloceanspaces.com/thumbs/gem-dommel-vibes-campaign-v09-still-2400-lr_1693987750_1800x1010.png,https://ddw.nl/en/programme/10348/dommel-vibes-de-verdieping,"[""WORKSHOP"", ""OUR LIVING ENVIRONMENT"", ""SPECULATIVE & SOCIAL DESIGN""]",Social Design
141,DommelPolitics,"See how the Dommel changes when animals are in charge, and experience how your vote directly influences the appearance of this waterway.","Centre area, Stadhuis, Stadhuisplein 1",,"The City Hall is dedicated to the Dommel, with an interactive presentation. Students from TU/e innovation Space allow you to view the waterway from a different perspective by uniting various animal species into political parties.",https://ddw.ams3.cdn.digitaloceanspaces.com/thumbs/dommelpolitics-2440x1600pix_1693519542_1800x1010.jpg,https://ddw.nl/en/programme/10177/dommelpolitics,"[""EXHIBITIONS"", ""OUR THRIVING PLANET"", ""SPECULATIVE & SOCIAL DESIGN""]",Bio Design
142,Doodle Series,"An ever expanding collection of unique, hand build and hand painted contemporary ceramics.","Sectie-C area, Collaboration O, Daalakkersweg 6",Free with DDW Ticket,"Doodle series came about during the first corona lockdown, from a need and want to create without having to be too serious and without having to think too much of the end result while having fun in doing.",https://ddw.ams3.cdn.digitaloceanspaces.com/thumbs/mayaelineleroy-doodleseries-2_1693484322_1800x1010.jpg,https://ddw.nl/en/programme/10801/doodle-series,,
143,Door de kieren vervlogen,An exploration of fragrant nostalgia,"Hallenweg area, De Fabriek, Baarsstraat 38",Free,"Through imagery and scent, Jip Schalkx and Louise Huyghe stir the viewers' nostalgia. Their installation sparks a sense of recognition and belonging, fostering a stronger sense of connection with cherished memories.",https://ddw.ams3.cdn.digitaloceanspaces.com/thumbs/ddw-image-1_1696431953_1800x1010.jpg,https://ddw.nl/en/programme/10326/door-de-kieren-vervlogen,"[""EXHIBITIONS"", ""OUR EQUAL SOCIETY"", ""INDEPENDENT & CRITICAL DESIGN""]",Art Design
144,DOUBLE DIP,An exclusive underground audio-visual conversation piece,"Hallenweg area, De Fabriek, Baarsstraat 38",Free,"""DOUBLE DIP is a commentary on the pseudo glamorous and self-indulgent lifestyle of the next generation of star designers. Thank you. No further comments.""",https://ddw.ams3.cdn.digitaloceanspaces.com/thumbs/doubledip-cover1-smaller-1_1693324324_1800x1010.jpeg,https://ddw.nl/en/programme/10737/double-dip,,
145,Doubleyou,,"Station area, Design Perron, Fuutlaan 12",Free,3D printed breast prostheses: People can scan their remaining breast to create a customised prosthesis with a personalised texture. A product with a new process that empowers and offers freedom and confidence.,https://ddw.ams3.cdn.digitaloceanspaces.com/thumbs/doubleyou-dominique-bertisch-lowres-07_1694937571_1800x1010.jpg,https://ddw.nl/en/programme/11073/doubleyou,,
146,Doucette,Crafting from Scraps: The Art of Tufted Creations in Doucette's Collection,"Strijp T+R area, Piet Hein Eek, Halvemaanstraat 30",Free,Doucette is a collection of domestic objects created using artisanal techniques and guided by ecological considerations towards the materials.,https://ddw.ams3.cdn.digitaloceanspaces.com/thumbs/sameo-picture_1693418267_1800x1010.jpg,https://ddw.nl/en/programme/10033/doucette,"[""EXHIBITIONS"", ""PRODUCT & CRAFT DESIGN""]",Design Research
147,Douwe Halbertsma; NEW HORIZON and MIRAGE,"Simple and clearly designed sculptures, playful shapes referring to the human figure.","Station area, Stationshal - Zuidhal - Eindhoven Centraal Station, Stationsplein 22",Free,"At Messmerizing Douwe presents a large, unique collectible art object MIRAGE together with a small object in limited edition NEW HORIZON.",https://ddw.ams3.cdn.digitaloceanspaces.com/thumbs/new-horizon-pink_1692023354_1800x1010.jpg,https://ddw.nl/en/programme/10578/douwe-halbertsma-new-horizon-and-mirage,,
148,Dream Cakes,pop-up patisserie and group exhibition,"Other area, Salon Veneman, Tongelresestraat 1",Free,Salon Veneman introduces a pop-up social hangout where we celebrate the sweet things in life with an international line-up of artists.,https://ddw.ams3.cdn.digitaloceanspaces.com/thumbs/ddwsite2_1693490891_1800x1010.jpg,https://ddw.nl/en/programme/10386/dream-cakes,"[""EXHIBITIONS"", ""OUR HEALTH & WELLBEING"", ""PRODUCT & CRAFT DESIGN""]",Experience Design
149,DREAM. DISCOVER. DESIGN.,TU Delft Industrial Design Engineering students & researchers welcome you to our first of its kind interactive exhibition,"Strijp-S area, Area 51 Basement, Ketelhuisplein 18",Free,"Is the current world designed for our needs? What is your DREAM for the future? DISCOVER the dream worlds created by designers from TU Delft Industrial Design Engineering in our immersive experience in Area51 (basement). Get inspired, excited, exhilarated to DESIGN your own future!",https://ddw.ams3.cdn.digitaloceanspaces.com/thumbs/tudelft-emailbanners-eng-05_1693297920_1800x1010.png,https://ddw.nl/en/programme/9788/dream-discover-design,"[""EXHIBITIONS"", ""EDUCATION""]",Social Design
150,DRIP040,Don’t worry just sport!,"Strijp-S area, Ketelhuisplein, Ketelhuisplein",Free,"The DRIP Foundation believes that all children and youth deserve equal opportunities. Everywhere and always, including at the sports club. Without social pressure, without judgment, without distinction. With DRIP040 we put the essence together: Don't worry just Sport!",https://ddw.ams3.cdn.digitaloceanspaces.com/thumbs/drip_1693654433_1800x1010.png,https://ddw.nl/en/programme/10072/drip040,"[""EXHIBITIONS"", ""OUR EQUAL SOCIETY"", ""PRODUCT & CRAFT DESIGN""]",Experience Design
151,DRIVE 2023,DESIGN RESEARCH & INNOVATION FESTIVAL,"Station area, de Effenaar, Dommelstraat 2",,"DRIVE is back! From October 23 to 27, we are back in the Effenaar (Eindhoven) for inspiring talks (DRIVE Live) and cool work sessions (DRIVE Works) during Dutch Design Week. We bring you inspiring examples of knowledge and innovation in and for the creative industry.",https://ddw.ams3.cdn.digitaloceanspaces.com/thumbs/header-logo-1920x1080-webproof-en-schermproof-small_1693840018_1800x1010.jpg,https://ddw.nl/en/programme/9739/drive-2023,,
152,Drum: Rock & Light!,"'Drum' is a 3D printed lamp inspired by musical cymbals. Apart from the central aluminium rod, it is printed with PLA, a filament made from corn.","Centre area, Schellens Fabriek, Bleekweg 1M",Free,"The 'Drum' lamp is rechargeable, portable, dimmable. It is made of PLA filament with 3D printing and it is inspired by the musical cymbals functioning. In fact Drum has a joint that allows the reflected light beam to be increased or decreased by raising or lowering the lower plate.",https://ddw.ams3.cdn.digitaloceanspaces.com/thumbs/foto1_1694431942_1800x1010.jpg,https://ddw.nl/en/programme/10941/drum-rock-amp-light,,
153,Dump Design - Redefining Recycling Centre Waste,A selection of the best circular products made from waste from the recycling centre Upcycle Centrum Almere.,"Strijp T+R area, Piet Hein Eek, Halvemaanstraat 30",Access,"At Dump Design you can witness our research on the development of new materials, made from recycle waste. These practical examples will inspire you. Circuit boards transformed into jewelry, sofas turned into bags, or flooring repurposed as tables, new design is possible where you don't expect it.",https://ddw.ams3.cdn.digitaloceanspaces.com/thumbs/dump-design-collective-klein_1694768607_1800x1010.png,https://ddw.nl/en/programme/9798/dump-design-redefining-recycling-centre-waste,"[""EXHIBITIONS"", ""OUR THRIVING PLANET"", ""PRODUCT & CRAFT DESIGN""]",Industrial Design
154,DUMP DESIGN: SIGNIFICANT LEATHER,"SIGNIFICANT LEATHER is honest, rough and no frills, nothing more, nothing less. Everything and everyone has value and significance.","Strijp T+R area, Piet Hein Eek, Halvemaanstraat 30",Access,"SIGNIFICANT LEATHER shows two identical bags in the same material and color scheme. They have had the same function before that both were labeled as waste.
A significant difference is who sat on it and what social position these bench sitters had. But is that seen by everyone?",https://ddw.ams3.cdn.digitaloceanspaces.com/thumbs/bags1-smaller_1693376972_1800x1010.jpg,https://ddw.nl/en/programme/10746/dump-design-significant-leather,,
155,DUO-TOON Project,SOLO en Samen op zoek naar nieuwe interieure vormen: een combinatie van ambacht en digitale ontwerp- en productietechniek met andere ontwerpers.,"Sectie-C area, Atelier Houtwerff, Daalakkersweg 4-26",Free with DDW Ticket,Voor dit DUO-TOON project toon ik als zelfproducerend meubelontwerper orgineel en zelfstandig ontwikkelde meubelobjecten. En we presenteren in samenwerking gemaakte interieurobjecten. Het project toont de gevoelsmatig (intuïtief) berekende schoonheid vanuit materiele en technische mogelijkheden.,https://ddw.ams3.cdn.digitaloceanspaces.com/thumbs/telgang_1693466289_1800x1010.jpg,https://ddw.nl/en/programme/10271/duo-toon-project,"[""EXHIBITIONS"", ""OUR LIVING ENVIRONMENT"", ""PRODUCT & CRAFT DESIGN"", ""GROUP EXHIBITION""]",Interior Design
156,Dutch Design Awards 2023,Exhibition of all nominees and winners of Dutch Design Awards 2023,"Strijp-S area, Microlab Hall, Kastanjelaan 400",Free with DDW Ticket,"Every year during DDW, DDA awards the best Dutch design of the past year, divided into eight categories. In addition, the DDA Exhibition displays all winning and nominated designs.",https://ddw.ams3.cdn.digitaloceanspaces.com/thumbs/logo-dda-high-res-1_1693554090_1800x1010.jpg,https://ddw.nl/en/programme/9726/dutch-design-awards-2023,,
157,Dutch Design Wijk,,"Strijp-S area, VEEM floor 8, Torenallee 100",Free,"Dutch Design WIJK -
Woensel West is the place to be! Dwaalhaas organises the Dutch Design WIJK. For everyone with a location, studio, Join the group: https://www.facebook.com/groups/662401482231871",https://ddw.ams3.cdn.digitaloceanspaces.com/thumbs/dwaalhaas_1694946658_1800x1010.jpg,https://ddw.nl/en/programme/11077/dutch-design-wijk,,
158,Eat Dust,,"Hallenweg area, De Fabriek, Baarsstraat 38",Free,"This work reimagines the once-controversial elements of the '90s import car culture. Its goal is to recapture the lost symbolism that represented identity and belonging. It involves the destruction and aestheticization of corporate logos, to gain a deeper connection to personal identity.",https://ddw.ams3.cdn.digitaloceanspaces.com/thumbs/screen-shot-2023-08-30-at-95653-pm_1693425423_1800x1010.png,https://ddw.nl/en/programme/10738/eat-dust,,
159,Echoes,,"Sectie-C area, Hall G, Daalakkersweg 6",,"An exhibition that delves into the heterogeneous origination of a series of one-off, collectable design pieces. Inspired by a diverse selection of materials cherished within the designer's studio over the years, the project resonates with a journey of memory, connection, and continuity.",https://ddw.ams3.cdn.digitaloceanspaces.com/thumbs/nd7-0251-post-ready-for-uploading-on-ddw-website-resized_1693041599_1800x1010.jpg,https://ddw.nl/en/programme/10032/echoes,"[""EXHIBITIONS"", ""SIGNATURE & COLLECTIBLE DESIGN""]",Design Research
160,École Camondo x Dutch Design Week,"Explore the projects of four young talents from Camondo School, graduated in 2023 : eco-design, craft, new technology, public space and well-being.","Strijp-S area, Klokgebouw | Hall 2, Klokgebouw 50",Free with DDW Ticket,"Featuring the talented graduates Léo Achard, Sarah Louche, Mathias Menager and Marine Plantefeve, the exhibition showcases their 2023 final projects at Camondo School. This is a unique opportunity for these young talents to express their creativity at the largest design event in Northern Europe.",https://ddw.ams3.cdn.digitaloceanspaces.com/thumbs/standentierdroite-1_1694633066_1800x1010.jpg,https://ddw.nl/en/programme/10686/ecole-camondo-x-dutch-design-week,,
161,Een eerlijke start voor de generatie van morgen,Invest in the first 1000 days of life - counted from conception to second birthday - and contribute to more resilient generations,"Strijp-S area, Microlab Hall, Kastanjelaan 400",Free with DDW Ticket,"Step into the magical world of the first 1000 days. Listen to one of our exercises - about how, as a caregiver, you can build a connection with your baby in the womb - and explore the science of linguistic development.",https://ddw.ams3.cdn.digitaloceanspaces.com/thumbs/buikpraat-olga-van-lingen-en-lotte-jonkergouw-portret-01-photo-selfportrait_1693515627_1800x1010.jpg,https://ddw.nl/en/programme/10054/een-eerlijke-start-voor-de-generatie-van-morgen,"[""EXHIBITIONS"", ""OUR EQUAL SOCIETY"", ""SPECULATIVE & SOCIAL DESIGN""]",Service Design
162,EGO DEATH,,"Strijp-S area, VEEM floor 8, Torenallee 100",Free,A collaboration between Artificial and Human Emotional intelligence.,https://ddw.ams3.cdn.digitaloceanspaces.com/thumbs/jaime5def_1694381620_1800x1010.jpg,https://ddw.nl/en/programme/11019/ego-death,,
163,Eilamp / Egglamp,A playful lamp made from real eggs.,"Strijp T+R area, Piet Hein Eek, Halvemaanstraat 30",Free,"As a fan of Droog Design, Ruben de Haas created a simple and fun lamp. These unique lightbulbs are surprisingly beautiful and interesting due to the imperfections of the eggshells.",https://ddw.ams3.cdn.digitaloceanspaces.com/thumbs/000-eilamp-copy_1692888498_1800x1010.jpg,https://ddw.nl/en/programme/10666/eilamp-egglamp,"[""EXHIBITIONS"", ""OUR THRIVING PLANET"", ""PRODUCT & CRAFT DESIGN""]",Interior Design
164,Embassy of Circular & Biobased Building,"If we want to build a sustainable world, we must consider the entire system.","Strijp-S area, Ketelhuisplein, Ketelhuisplein",Free,"The Embassy explores new perspectives for a sustainable living environment in collaboration with stakeholders and knowledge partners from the construction and agriculture sectors. Through storytelling and imagination, we involve experts and the general public in this research and its outcomes.",https://ddw.ams3.cdn.digitaloceanspaces.com/thumbs/possible-landscapes-de-peel-maquetteinstallatie-c-abouttoday-2023-05-232731-lr_1693553956_1800x1010.jpg,https://ddw.nl/en/programme/10056/embassy-of-circular-amp-biobased-building,"[""EXHIBITIONS"", ""OUR LIVING ENVIRONMENT"", ""SERVICE & INNOVATIVE DESIGN""]",Design Research
165,Embassy of Food,,"West area, Evoluon, Noord Brabantlaan 1A",,The Embassy of Food believes in the role that designers can play in shaping the world behind our food and the relationship we all have with our food.,https://ddw.ams3.cdn.digitaloceanspaces.com/thumbs/food-credits-kadir-van-lohuizen-noor_1692263779_1800x1010.jpeg,https://ddw.nl/en/programme/9969/embassy-of-food,"[""EXHIBITIONS"", ""OUR HEALTH & WELLBEING"", ""SERVICE & INNOVATIVE DESIGN""]",Food Design
166,Embassy of Health,How can we put health first in our society by utilising the power of design?,"Strijp-S area, Foundation We Are, Torenallee 22-04",,"Can we see our health as a value in itself? How can we save health, let it flow, exchange and share it with each other? How can design and imagination contribute to a (re)valuation of health as our greatest good?",https://ddw.ams3.cdn.digitaloceanspaces.com/thumbs/lr-commin-in-lodewijkvandeyselstraat-16-copy_1693302035_1800x1010.jpg,https://ddw.nl/en/programme/9981/embassy-of-health,"[""EXHIBITIONS"", ""OUR HEALTH & WELLBEING"", ""SPECULATIVE & SOCIAL DESIGN""]",Health Design
167,Embassy of Inclusive Society,"The society we live in seems to embrace diversity, but is the work being done to actually become more just?","Centre area, Van Abbemuseum, Stratumsedijk 2",Free with DDW Ticket,"This year, the Embassy is initiating various (un)learning spaces. Together with the Embassy coalition partners, we gather to exchange current challenges, methods and shared ambitions.",https://ddw.ams3.cdn.digitaloceanspaces.com/thumbs/multiform-c-iris-rijskamp-copy-1-min_1692267738_1800x1010.jpg,https://ddw.nl/en/programme/9983/embassy-of-inclusive-society,"[""EXHIBITIONS"", ""OUR EQUAL SOCIETY"", ""SPECULATIVE & SOCIAL DESIGN""]",Social Design
168,Embassy of Mobility,"Creating liveable cities together, that is what the Embassy of Mobility stands for.","Strijp-S area, Donna, Philitelaan 57",Free,What does our city look like without cars in front of the door? And what do we get in place of them? More greenery? More homes? Places to get together and relax? We will explore these questions together and experiment with possible solutions.,https://ddw.ams3.cdn.digitaloceanspaces.com/thumbs/bosk-arcadia-2022-locatie-7-gouveneursplein-foto-floris-leeuwenberg_1695367682_1800x1010.jpg,https://ddw.nl/en/programme/9980/embassy-of-mobility,"[""EXHIBITIONS"", ""OUR LIVING ENVIRONMENT"", ""SERVICE & INNOVATIVE DESIGN""]",Experience Design
169,Embassy of Mobility Living Lab,,"Strijp-S area, Donna, Philitelaan 57",Free,"Creating liveable cities together, that is what the Embassy of Mobility stands for. With creative makers, such as designers and mobility professionals, but especially with city residents, travellers and companies. We can brainstorm, experiment and change together.",https://ddw.ams3.cdn.digitaloceanspaces.com/thumbs/643edf3714e3f-bosk-locatie-7-gouveneursplein-foto-floris-leeuwenberg-1-1500x0-c-default_1694417944_1800x1010.jpg,https://ddw.nl/en/programme/10646/embassy-of-mobility-living-lab,,
170,Embassy of Safety,In the Embassy of Safety we are going to look for new ways of making and making amends.,"Strijp-S area, Klokgebouw | Hall 3, Klokgebouw 50",Free with DDW Ticket,Those who understand how their criminal actions have impacted others and have managed to reconcile with them are far less likely to be repeat offenders. That’s why we’re searching for additional ways of making amends.,https://ddw.ams3.cdn.digitaloceanspaces.com/thumbs/fluer-ontwapens-0173klein_1693552651_1800x1010.jpg,https://ddw.nl/en/programme/9982/embassy-of-safety,"[""EXHIBITIONS"", ""OUR EQUAL SOCIETY"", ""SPECULATIVE & SOCIAL DESIGN""]",Social Design
171,Embassy of Water,,"Centre area, Stadhuisplein, Stadhuisplein",11:00 - 18:00,"The Embassy of Water gathers the water design of the past five years and brings it together in a pavilion at Stadhuisplein during Dutch Design Week 2023 (DDW23). Expect a grand plan for water restoration for homes, a new way of thinking about water, and more.",https://ddw.ams3.cdn.digitaloceanspaces.com/thumbs/beeld-narratief-water-2023_1694526040_1800x1010.jpg,https://ddw.nl/en/programme/9979/embassy-of-water,"[""EXHIBITIONS"", ""OUR LIVING ENVIRONMENT"", ""SERVICE & INNOVATIVE DESIGN""]",Bio Design
172,EMBRYØ,"all of us, encoded","Hallenweg area, De Fabriek, Baarsstraat 38",Free,An exploration of craft in an age of digitization.,https://ddw.ams3.cdn.digitaloceanspaces.com/thumbs/carolinatrinker-parsonsschoolofdesign-1_1693487290_1800x1010.jpg,https://ddw.nl/en/programme/10373/embryo,"[""EXHIBITIONS"", ""OUR DIGITAL FUTURE"", ""INDEPENDENT & CRITICAL DESIGN""]",Fashion Design
